{
  "claims": [
    {
      "claim_locators": [
        {
          "file_sha256": "57dfe86cd0892df3e64245cfcd88822f9942e7bfebd9a82d3d686ad1b11ca43b",
          "locator": "Proposition 1, equations 3-4, and inline proof",
          "path": "manuscript/manuscript.md",
          "precision": "named_locator"
        },
        {
          "file_sha256": "1f919642e245e3ad42df6d389095c4c61c332f4516cdc7846070ad470aa6415f",
          "locator": null,
          "path": "src/sppt_core.py",
          "precision": "file_level"
        },
        {
          "file_sha256": "45d4cbb56ff6d569362251b189dd36902d28e745c08e197d2bbea9ec7941df00",
          "locator": null,
          "path": "tests/test_sppt_core.py",
          "precision": "named_locator"
        }
      ],
      "claim_type": "theorem",
      "coverage_notes": [],
      "coverage_status": "tracked_structural",
      "disposition": "admit",
      "domain_units_signs_boundary_quantifiers": "All reservoir inventories use a common unit per species; flux signs follow the directed incidence convention; the result holds for every internal flux and reaction rate satisfying the hypotheses.",
      "evidence_class": "hand_checked",
      "execution": {
        "command": null,
        "run_id": null,
        "runtime": null,
        "status": "not_applicable_to_legacy_record"
      },
      "hypotheses": [
        "finite reservoir and edge sets",
        "dimensionally compatible species inventories and edge fluxes",
        "each internal edge has one -1 tail and one +1 head",
        "w^T N = 0",
        "S-E = 0 for the closed inventory"
      ],
      "id": "SPPT-C001",
      "limitations_or_counterexamples": [
        "Fails for undeclared sources, sinks, escape, dimension mismatch, or nonconserving reaction weights."
      ],
      "source_links": [
        {
          "admitted_path": "manuscript/manuscript.md",
          "admitted_sha256": "57dfe86cd0892df3e64245cfcd88822f9942e7bfebd9a82d3d686ad1b11ca43b",
          "entailment_status": "structural_link_only",
          "kind": "tracked_file",
          "raw_support": "manuscript/manuscript.md Proposition 1, equations 3-4, and inline proof",
          "reference": "manuscript/manuscript.md",
          "retrieval_date": null,
          "source_record_version": null,
          "supplied_input_sha256": null
        },
        {
          "admitted_path": "src/sppt_core.py",
          "admitted_sha256": "1f919642e245e3ad42df6d389095c4c61c332f4516cdc7846070ad470aa6415f",
          "entailment_status": "structural_link_only",
          "kind": "tracked_file",
          "raw_support": "src/sppt_core.py",
          "reference": "src/sppt_core.py",
          "retrieval_date": null,
          "source_record_version": null,
          "supplied_input_sha256": null
        },
        {
          "admitted_path": "tests/test_sppt_core.py",
          "admitted_sha256": "45d4cbb56ff6d569362251b189dd36902d28e745c08e197d2bbea9ec7941df00",
          "entailment_status": "structural_link_only",
          "kind": "tracked_file",
          "raw_support": "tests/test_sppt_core.py",
          "reference": "tests/test_sppt_core.py",
          "retrieval_date": null,
          "source_record_version": null,
          "supplied_input_sha256": null
        }
      ],
      "statement": "For the stated node-edge incidence convention, internal transport conserves whole-network inventory, and a weighted inventory is conserved when the declared reaction weights annihilate the stoichiometric matrix and external source minus escape is zero."
    },
    {
      "claim_locators": [
        {
          "file_sha256": "57dfe86cd0892df3e64245cfcd88822f9942e7bfebd9a82d3d686ad1b11ca43b",
          "locator": "equations 7-8",
          "path": "manuscript/manuscript.md",
          "precision": "named_locator"
        },
        {
          "file_sha256": "8ac6e1f29fea60da7dc583c7c122fb1394a807624f67fa052908e38574dd4b22",
          "locator": "Onsager I/II and Casimir sources in",
          "path": "manuscript/references.bib",
          "precision": "file_level"
        }
      ],
      "claim_type": "thermodynamic admissibility condition",
      "coverage_notes": [],
      "coverage_status": "tracked_structural",
      "disposition": "admit_with_qualification",
      "domain_units_signs_boundary_quantifiers": "Temperature is positive; chemical/electrical signs use the manuscript convention; the statement is local and near-equilibrium unless a constitutive law establishes a wider domain.",
      "evidence_class": "hand_checked",
      "execution": {
        "command": null,
        "run_id": null,
        "runtime": null,
        "status": "not_applicable_to_legacy_record"
      },
      "hypotheses": [
        "conjugate forces and fluxes are consistently defined",
        "the symmetric dissipative part is positive semidefinite",
        "Casimir-antisymmetric terms do not contribute to the quadratic entropy production"
      ],
      "id": "SPPT-C002",
      "limitations_or_counterexamples": [
        "It is not a proof that every proposed nonlinear or far-from-equilibrium edge law is admissible."
      ],
      "source_links": [
        {
          "admitted_path": "manuscript/manuscript.md",
          "admitted_sha256": "57dfe86cd0892df3e64245cfcd88822f9942e7bfebd9a82d3d686ad1b11ca43b",
          "entailment_status": "structural_link_only",
          "kind": "tracked_file",
          "raw_support": "manuscript/manuscript.md equations 7-8",
          "reference": "manuscript/manuscript.md",
          "retrieval_date": null,
          "source_record_version": null,
          "supplied_input_sha256": null
        },
        {
          "admitted_path": "manuscript/references.bib",
          "admitted_sha256": "8ac6e1f29fea60da7dc583c7c122fb1394a807624f67fa052908e38574dd4b22",
          "entailment_status": "structural_link_only",
          "kind": "tracked_file",
          "raw_support": "Onsager I/II and Casimir sources in manuscript/references.bib",
          "reference": "manuscript/references.bib",
          "retrieval_date": null,
          "source_record_version": null,
          "supplied_input_sha256": null
        }
      ],
      "statement": "The declared linear constitutive closure has nonnegative local entropy production when its phenomenological matrix is positive semidefinite on the declared force-flux domain."
    },
    {
      "claim_locators": [
        {
          "file_sha256": "57dfe86cd0892df3e64245cfcd88822f9942e7bfebd9a82d3d686ad1b11ca43b",
          "locator": "equations 17-19 and Appendix A.1",
          "path": "manuscript/manuscript.md",
          "precision": "named_locator"
        },
        {
          "file_sha256": "1f919642e245e3ad42df6d389095c4c61c332f4516cdc7846070ad470aa6415f",
          "locator": null,
          "path": "src/sppt_core.py",
          "precision": "file_level"
        },
        {
          "file_sha256": "45d4cbb56ff6d569362251b189dd36902d28e745c08e197d2bbea9ec7941df00",
          "locator": null,
          "path": "tests/test_sppt_core.py",
          "precision": "named_locator"
        }
      ],
      "claim_type": "analytic calculation",
      "coverage_notes": [
        "The exact reproduction command, runtime, and run identifier are not encoded in the legacy claim matrix."
      ],
      "coverage_status": "tracked_structural",
      "disposition": "admit",
      "domain_units_signs_boundary_quantifiers": "M has inventory units, c has inventory/time units, tau is time, and omega is inverse time; the loop sign follows increasing time and the manuscript's M-versus-c orientation.",
      "evidence_class": "independently_reproduced",
      "execution": {
        "command": null,
        "run_id": null,
        "runtime": null,
        "status": "not_recorded_in_claim_matrix"
      },
      "hypotheses": [
        "omega > 0",
        "tau > 0",
        "steady periodic regime after transients",
        "c(t)=c0+c1 cos(omega t)"
      ],
      "id": "SPPT-C003",
      "limitations_or_counterexamples": [
        "The result is for a linear single-timescale trap, not a general nonlinear phase reservoir."
      ],
      "source_links": [
        {
          "admitted_path": "manuscript/manuscript.md",
          "admitted_sha256": "57dfe86cd0892df3e64245cfcd88822f9942e7bfebd9a82d3d686ad1b11ca43b",
          "entailment_status": "structural_link_only",
          "kind": "tracked_file",
          "raw_support": "manuscript/manuscript.md equations 17-19 and Appendix A.1",
          "reference": "manuscript/manuscript.md",
          "retrieval_date": null,
          "source_record_version": null,
          "supplied_input_sha256": null
        },
        {
          "admitted_path": "src/sppt_core.py",
          "admitted_sha256": "1f919642e245e3ad42df6d389095c4c61c332f4516cdc7846070ad470aa6415f",
          "entailment_status": "structural_link_only",
          "kind": "tracked_file",
          "raw_support": "src/sppt_core.py",
          "reference": "src/sppt_core.py",
          "retrieval_date": null,
          "source_record_version": null,
          "supplied_input_sha256": null
        },
        {
          "admitted_path": "tests/test_sppt_core.py",
          "admitted_sha256": "45d4cbb56ff6d569362251b189dd36902d28e745c08e197d2bbea9ec7941df00",
          "entailment_status": "structural_link_only",
          "kind": "tracked_file",
          "raw_support": "tests/test_sppt_core.py",
          "reference": "tests/test_sppt_core.py",
          "retrieval_date": null,
          "source_record_version": null,
          "supplied_input_sha256": null
        }
      ],
      "statement": "The steady periodic solution of dM/dt = c0 + c1 cos(omega t) - M/tau and the signed loop integral integral M dc equal the displayed formulas."
    },
    {
      "claim_locators": [
        {
          "file_sha256": "57dfe86cd0892df3e64245cfcd88822f9942e7bfebd9a82d3d686ad1b11ca43b",